Priority,Action,Category,Region,Impact_M$,Effort,Confidence_%,Timeframe_Days,ROI_%,Details
1,Aumentar inventario Star Wars +20%,Star Wars,Norteamérica,4.2,Medium,91,21,133,"CONTEXT: Disney+ Ahsoka series launches Nov 15. Historical pattern shows +28% sales during Star Wars content releases. Current inventory: 45K units insufficient for predicted demand spike.\n\nACTION: Order 27K additional units: 75331 Mandalorian Starfighter (12K), 75341 Luke's Landspeeder (8K), 75355 X-Wing (7K).\n\nFINANCIAL: Additional sales €4.2M, Inventory cost €1.8M, Net margin €2.4M, ROI 133%.\n\nTIMING: Order by Nov 5, Production lead time 3 weeks, Arrival Nov 28, Sales window Dec 1-24.\n\nRISK: 73% probability of stockout if no action. Competitor availability high."
2,Lanzar promoción Friends en Europa Central,Friends,Europa Central,1.8,Low,84,14,245,"CONTEXT: Heartlake Hospital viral on TikTok (2.3M views). Demand spike +65% detected. Stock risk in Germany, Poland, Czech Republic.\n\nACTION: Flash 15% discount + free shipping for 14 days. Target demographics: Girls 6-12, Parents 30-45. Channels: Email, Instagram, TikTok ads.\n\nFINANCIAL: Incremental sales €1.8M, Promo cost €450K, Marketing €280K, Net margin €1.07M, ROI 245%.\n\nTIMING: Launch within 7 days to capture viral momentum. Campaign duration 14 days.\n\nRISK: Viral trends decay rapidly. 84% confidence assumes action within 1 week."
3,Reducir precio City en Brasil -12%,City,Brasil,0.95,Low,78,7,156,"CONTEXT: Brazil economic slowdown + currency devaluation. Price elasticity analysis shows -12% price → +34% volume in emerging markets.\n\nACTION: Tactical price reduction on 8 core City SKUs. Maintain premium positioning on complex sets. Test for 90 days.\n\nFINANCIAL: Volume increase 34% (8.2K→11K units/month), Revenue +€950K, Margin compression offset by volume, Net +€420K, ROI 156%.\n\nTIMING: Implement by Nov 10 to capture holiday season. Review after 90 days.\n\nRISK: Potential brand dilution if prolonged. Monitor competitor response."
4,Expandir línea Botanicals con 3 nuevos sets,Botanicals,Global,3.5,High,92,180,412,"CONTEXT: Fastest growing category +156% in 3 months. Pinterest searches +240%. Target: Adult women 25-45 (non-traditional LEGO buyers). Home decor trend.\n\nACTION: Develop 3 new sets: Orchid Garden (€89), Succulent Collection (€59), Bonsai Tree v2 (€69). Launch Q2 2025.\n\nFINANCIAL: Development cost €850K, Marketing €420K, Projected sales €5.2M (Year 1), Net margin €3.5M, ROI 412%.\n\nTIMING: Design phase 60 days, Production 90 days, Launch May 2025. Pre-orders March 2025.\n\nRISK: Trend sustainability uncertain. Diversify designs to appeal to multiple aesthetics."
5,Redistribuir inventario Creator desde Asia a Europa,Creator,Europa,0.68,Medium,88,30,185,"CONTEXT: Asia-Pacific Creator sales -18% below forecast. Europe +22% above forecast. Inventory imbalance detected. Modular Buildings high demand in Europe.\n\nACTION: Ship 8.5K units from Singapore warehouse to Rotterdam. Focus on Architecture and Modular Buildings SKUs.\n\nFINANCIAL: Logistics cost €240K, Avoided markdowns in Asia €320K, Incremental EU sales €680K, Net margin €680K, ROI 185%.\n\nTIMING: Initiate shipment by Nov 8. Transit time 21 days. Arrival Nov 29 (pre-holiday).\n\nRISK: Currency fluctuation exposure during transit. Hedge recommended."
6,Implementar programa VIP Coleccionistas,All Premium,Global,1.52,Medium,79,90,744,"CONTEXT: 'Premium Collectors' segment = 12% customers but 38% revenue. CLV €2,400. High retention value. Competitor programs emerging.\n\nACTION: Launch VIP tier: Early access to exclusives, Designer interviews, Flagship events, Personalized recommendations.\n\nFINANCIAL: Program cost €180K/year (platform + events), Retention improvement +15%, Incremental revenue €1.52M, ROI 744%.\n\nTIMING: Soft launch Jan 2025 (500 beta users). Full launch March 2025 (5K members).\n\nRISK: Cannibalization of regular sales minimal (different purchase patterns). Exclusivity must be maintained."
7,Liquidar inventario Ninjago Legacy -40%,Ninjago Legacy,Global,-3.1,Low,88,45,Break-even,"CONTEXT: New Ninjago season launched. Legacy sets sales -78%. €3.1M inventory at risk of obsolescence. Holding cost €45K/month.\n\nACTION: Aggressive clearance: -40% discount + bundle with new season sets. Multi-channel: Online, outlet stores, B2B liquidators.\n\nFINANCIAL: Recovery €1.85M (60% of inventory value), Loss mitigation €1.25M vs full write-off, Break-even on holding costs.\n\nTIMING: Launch clearance Nov 10. Complete liquidation by Dec 25 (45 days). Avoid Q1 2025 write-off.\n\nRISK: Brand perception if too aggressive. Position as 'collector's last chance' not 'clearance'."
8,Diversificar portfolio: Reducir Marvel +20% STEM,Multiple,Global,2.8,High,76,365,198,"CONTEXT: Marvel superhero sales growth deceleration -15% QoQ. Market saturation signals. STEM education trend +45% growth. Government education budgets increasing.\n\nACTION: Reduce Marvel SKUs 20% (eliminate low performers). Invest savings in STEM/Education line expansion. Target schools, parents.\n\nFINANCIAL: Marvel revenue impact -€1.2M, STEM incremental +€4.0M, Net gain €2.8M, Investment €950K, ROI 198%.\n\nTIMING: Phase 1 (Marvel reduction) Q1 2025. Phase 2 (STEM launch) Q2-Q3 2025. Full year impact.\n\nRISK: Marvel still profitable. Don't over-correct. Monitor Disney content calendar for resurgence opportunities."
