Phase_ID,Phase_Code,Phase_Name,Description,Key_Actions,Results,Timeline,Status
1,I,IDENTIFICAR,"Identificación de los intangibles críticos que definen el futuro de LEGO","Auditoría completa de activos intangibles | Mapeo de valor de marca histórico | Análisis de comunidad de fans | Evaluación de propiedad intelectual","Identificados 3 intangibles críticos: Marca LEGO, Comunidad de Fans, Sistema de Juego | Valor de marca cuantificado: $2.1B (2003) | Engagement comunidad: 15% activo",2004-2005,Diagnóstico
2,V,VALORAR,"Cuantificación del impacto financiero de los intangibles","Aplicación metodología Relief from Royalty para marca | Valoración comunidad mediante Customer Lifetime Value | Cálculo ROI potencial de innovación digital","Coste de oportunidad marca: $2.5B no capitalizado | Valor potencial comunidad: $1.8B | ROI innovación digital proyectado: 450%",2005-2006,Diagnóstico
3,A,ACTIVAR,"Conversión de intangibles en acciones estratégicas concretas","Lanzamiento LEGO Ideas (co-creación) | Reducción complejidad: 13,000 → 6,000 SKUs | Expansión digital: videojuegos, apps, contenido","Productos co-creados: 42% del portfolio | Reducción complejidad: 60% | Ventas digitales: 5% → 32%",2006-2010,Ejecución
4,L,LIDERAR,"Gobierno corporativo y liderazgo del cambio","Jørgen Vig Knudstorp asume CEO | Alineación estratégica total | Disciplina financiera estricta | Cultura de innovación sistemática","Alineación estratégica: 88% equipos | Disciplina financiera: 90% cumplimiento | Rotación talento clave: <5%",2004-2014,Ejecución
5,O,ORGANIZAR,"Reestructuración organizacional y de procesos","Optimización cadena de suministro | Reducción tiempo desarrollo: 18 → 7 meses | Implementación sistemas ERP integrados | Automatización procesos","Eficiencia supply chain: 85% | Tiempo desarrollo producto: -61% | Productividad por empleado: +180%",2006-2012,Resultados
6,R,RETORNAR,"Retorno de la inversión en intangibles","Crecimiento ingresos: +594% (2003-2014) | Margen operativo: 2.4% → 27% | Liderazgo mercado: #8 → #1 | Valoración empresa: +900%","ROI total: +900% | Crecimiento ingresos: $735M → $5,100M | Margen operativo: +1,025% | Líder mundial juguetes",2003-2014,Resultados

